{
  "schema_version": 1,
  "task": {
    "id": "task-index-review",
    "repository": "ampm-backend",
    "objective": "Confirm that lesson publishing routes to the content component."
  },
  "routing": {
    "repository_index": ".esc-ai/esc-index.json",
    "components": [
      {
        "id": "content",
        "purpose": "Owns curriculum and lesson content.",
        "manifest": ".esc-ai/components/content/esc-component.yaml",
        "index": ".esc-ai/components/content/esc-index.json",
        "search_roots": ["content/src/main", "content/src/test"]
      }
    ]
  },
  "scope": {
    "paths": [".esc-ai/components/content/esc-index.json"],
    "references": [".esc-ai/esc-index.json"],
    "completion_conditions": ["The content component is ranked first."]
  },
  "bounds": {
    "max_components": 10,
    "max_paths": 30,
    "max_references": 30
  }
}
